[
  { "id": "female", "aliases": ["girl", "woman", "lady", "gal"], "tags": ["1girl"], "category": "character" },
  { "id": "male", "aliases": ["boy", "man", "guy"], "tags": ["1boy"], "category": "character" },
  { "id": "multiple_girls", "aliases": ["girls"], "tags": ["multiple girls"], "category": "character" },
  { "id": "multiple_boys", "aliases": ["boys"], "tags": ["multiple boys"], "category": "character" },
  { "id": "child", "aliases": ["kid"], "tags": ["child"], "category": "character" },

  { "id": "young", "tags": ["young"], "category": "appearance" },
  { "id": "adult", "tags": ["adult"], "category": "appearance" },
  { "id": "slim", "aliases": ["slender"], "tags": ["slim"], "category": "appearance" },
  { "id": "muscular", "tags": ["muscular"], "category": "appearance" },
  { "id": "dark_skin", "aliases": ["tan skin", "tanned"], "tags": ["dark skin"], "category": "appearance" },
  { "id": "pale_skin", "tags": ["pale skin"], "category": "appearance" },

  { "id": "long_hair", "aliases": ["lengthy hair"], "tags": ["long hair"], "category": "hair" },
  { "id": "short_hair", "tags": ["short hair"], "category": "hair" },
  { "id": "medium_hair", "tags": ["medium hair"], "category": "hair" },
  { "id": "very_long_hair", "tags": ["very long hair"], "category": "hair" },
  { "id": "blonde_hair", "aliases": ["blond hair", "golden hair"], "tags": ["blonde hair"], "category": "hair" },
  { "id": "brown_hair", "aliases": ["brunette"], "tags": ["brown hair"], "category": "hair" },
  { "id": "black_hair", "tags": ["black hair"], "category": "hair" },
  { "id": "red_hair", "aliases": ["ginger hair"], "tags": ["red hair"], "category": "hair" },
  { "id": "blue_hair", "tags": ["blue hair"], "category": "hair" },
  { "id": "white_hair", "tags": ["white hair"], "category": "hair" },
  { "id": "silver_hair", "aliases": ["grey hair", "gray hair"], "tags": ["silver hair"], "category": "hair" },
  { "id": "pink_hair", "tags": ["pink hair"], "category": "hair" },
  { "id": "ponytail", "tags": ["ponytail"], "category": "hair" },
  { "id": "twintails", "aliases": ["twin tails", "pigtails"], "tags": ["twintails"], "category": "hair" },
  { "id": "braid", "aliases": ["braided hair"], "tags": ["braid"], "category": "hair" },
  { "id": "twin_braids", "tags": ["twin braids"], "category": "hair", "expand": ["braid"] },
  { "id": "curly_hair", "tags": ["curly hair"], "category": "hair" },
  { "id": "straight_hair", "tags": ["straight hair"], "category": "hair" },
  { "id": "bangs", "tags": ["bangs"], "category": "hair" },

  { "id": "blue_eyes", "aliases": ["azure eyes"], "tags": ["blue eyes"], "category": "eyes" },
  { "id": "green_eyes", "tags": ["green eyes"], "category": "eyes" },
  { "id": "red_eyes", "tags": ["red eyes"], "category": "eyes" },
  { "id": "brown_eyes", "tags": ["brown eyes"], "category": "eyes" },
  { "id": "purple_eyes", "aliases": ["violet eyes"], "tags": ["purple eyes"], "category": "eyes" },
  { "id": "yellow_eyes", "tags": ["yellow eyes"], "category": "eyes" },
  { "id": "closed_eyes", "tags": ["closed eyes"], "category": "eyes" },
  { "id": "heterochromia", "tags": ["heterochromia"], "category": "eyes" },

  { "id": "freckles", "tags": ["freckles"], "category": "face" },
  { "id": "mole", "tags": ["mole"], "category": "face" },
  { "id": "fang", "tags": ["fang"], "category": "face" },
  { "id": "lipstick", "tags": ["lipstick"], "category": "face" },
  { "id": "makeup", "tags": ["makeup"], "category": "face" }
]
